{"$schema":"https://json-schema.org/draft/2020-12/schema","type":"object","additionalProperties":false,"required":["release_version","git_sha","chart_version","application_version","created_at","Elasticsearch_version","Kibana_version","terminal_migration","components"],"properties":{"release_version":{"type":"string"},"git_sha":{"type":"string","pattern":"^[0-9a-f]{40}$"},"chart_version":{"type":"string"},"application_version":{"type":"string"},"created_at":{"type":"string","format":"date-time"},"Elasticsearch_version":{"type":"string"},"Kibana_version":{"type":"string"},"terminal_migration":{"const":"0033_team1_stream_schema_intelligence_runtime"},"components":{"type":"object","minProperties":9,"additionalProperties":{"type":"object","additionalProperties":false,"required":["image_repository","image_tag","image_digest","SBOM","signature","provenance","certification_artifact"],"properties":{"image_repository":{"type":"string","minLength":1},"image_tag":{"type":"string","not":{"const":"latest"}},"image_digest":{"type":"string","pattern":"^sha256:[0-9a-f]{64}$"},"SBOM":{"type":"string"},"signature":{"type":"string"},"provenance":{"type":"string"},"certification_artifact":{"type":"string"}}}}}}
